original_id_x;date_created;resource_type;specific_resource_type;specific_type;post_type;stream_type;object_name;object_content;from_id;from_username;name;content;final_sentiment;from_display_picture;media_link;link;bio;reply_to_original_id;reply_to_user_id;retweet_from_original_id;retweet_from_user_id;identifikasi;original_id_y;content_y;link_y
"1,79E+16";17/07/2024 15.42.31;social_media;instagram;comment;talk;account;ipbofficial;1818662133;1548967653;fajardani10;fajardani10;FKH kosong nih?;neutral;https://instagram.fbdo10-1.fna.fbcdn.net/v/t51.2885-19/352398849_2039625033047238_3089740186656479361_n.jpg?stp=dst-jpg_s150x150&_nc_ht=instagram.fbdo10-1.fna.fbcdn.net&_nc_cat=106&_nc_ohc=eY5giP00CGMQ7kNvgFDhhjA&edm=AI-cjbYBAAAA&ccb=7-5&oh=00_AYCHVU5TLzlYnx_s6htZ3ulEVDKWuFED3YA9X7Ec0NCBKQ&oe=669DFEB9&_nc_sid=0985b0;nan;https://instagram.com/p/C9hCis9yY81/17867087361157688;nan;"3,41E+18";nan;nan;nan;no-take-out;"3,41E+18";#WisudaIPB  Rasa banggamu saat ini harus terus dipupuk Agar ia dapat menumbuhkan rasa ingin tahu tak terbatas Dan menegakkan integritas di manapun kita berkarya  Kami ucapkan selamat kepada Lulusan Terbaik Wisuda Tahap VII Tahun Akademik 2023/2024 Menuju tak terbatas dan melampauinya!  #IPBUniversity #IPBNesian #KampusTerbaik #KampusMerdeka;https://instagram.com/p/C9hCis9yY81
"1,81E+18";16/07/2024 20.46.55;social_media;twitter;status;talk;keyword;IPB;IPB;"1,41E+18";tasawbi;manda👀;Fomo liat maba ipb sudah post twibbon;negative;https://pbs.twimg.com/profile_images/1810508186048483328/8Aa-7Bwj_normal.jpg;nan;https://twitter.com/tasawbi/status/1813208693959500184;"workhard, studyhard, istirahard";nan;nan;nan;nan;no-take-out;nan;nan;nan
"1,79E+16";30/07/2024 09.45.59;social_media;instagram;comment;talk;account;ipbofficial;1818662133;1934539908;nandogangga;nandogangga;Footage nya ke asrama putra juga dong 😌;neutral;https://instagram.fbdo10-1.fna.fbcdn.net/v/t51.2885-19/449127131_517869410672797_7585311484795469502_n.jpg?stp=dst-jpg_s150x150&_nc_ht=instagram.fbdo10-1.fna.fbcdn.net&_nc_cat=101&_nc_ohc=d703XCnFXFYQ7kNvgFL5e1U&edm=AI-cjbYBAAAA&ccb=7-5&oh=00_AYBg570GtYj4f5rA5-Po3Jk5wNdEgskdKEXurMY96TqvOw&oe=66B06502&_nc_sid=0985b0;nan;https://www.instagram.com/p/C-AYgWHy5NB/17897938122020405;nan;"3,42E+18";nan;nan;nan;no-take-out;"3,42E+18";"Apa boleh masuk asrama sebahagia ini?🫵🏻 Hai, Narapati Bimantara! Yuk kita simak bersama kesan-kesan pertama para penghuni baru asrama IPB University berikut ini!  #IPBUniversity #IPBNesian #KampusTerbaik #KampusMerdeka";https://www.instagram.com/p/C-AYgWHy5NB/
"1,83E+16";13/08/2024 22.17.37;social_media;instagram;comment;talk;account;ipbofficial;1818662133;9419386105;alvinoffcial;alvinoffcial;FPIK BIRU!;neutral;https://instagram.fbdo10-1.fna.fbcdn.net/v/t51.2885-19/443718390_1919784685146354_3051685658115349295_n.jpg?stp=dst-jpg_s150x150&_nc_ht=instagram.fbdo10-1.fna.fbcdn.net&_nc_cat=106&_nc_ohc=p_IQ7bNkPwkQ7kNvgGvr97F&edm=AI-cjbYBAAAA&ccb=7-5&oh=00_AYD0-WmPXUwUlWdY4w-ZfWLk2ebVwR5zwsrT7cLcf_oLfA&oe=66C191CF&_nc_sid=0985b0;nan;https://instagram.com/p/C-m23UBS-Bp/18271569445211464;nan;"3,43E+18";nan;nan;nan;no-take-out;"3,43E+18";"Halo #IPBNesian!   Keterbatasan tidak menjadi penghalang semangat untuk turut memecahkan World Record: The Dynamic Human 3D Interactive Motion Kaleidoscope Formation. Yuk, simak kesan dari mereka!  #IPBUniversity #IPBNesian #KampusTerbaik #KampusMerdeka";https://instagram.com/p/C-m23UBS-Bp
"1,82E+18";31/07/2024 08.56.04;social_media;twitter;status;talk;keyword;IPB;IPB;"1,81E+18";bync____;‎bebe paus ★;from bravo? bhawikarsu! to ipb! digdaya!;positive;https://pbs.twimg.com/profile_images/1814225190949474305/O_9LOqOd_normal.jpg;nan;https://twitter.com/bync____/status/1818465624441712716;veterinary medicine ipb ‘61;nan;nan;nan;nan;no-take-out;nan;nan;nan
"1,81E+18";20/07/2024 23.08.43;social_media;twitter;status;talk;keyword;IPB;IPB;"1,04E+18";IPBbercanda;IPB Bercanda;fun fact  lulusan IPB gak punya moral responsibility;negative;https://pbs.twimg.com/profile_images/1667969654705491969/1WUPIb-T_normal.jpg;nan;https://twitter.com/IPBbercanda/status/1814693931080429924;follow us for ipb f r e s h memes | check our https://t.co/RhcOZhcKI6 | Media Partner & Paid Promote langsung ke Telegram kami ya!;nan;nan;nan;nan;no-take-out;nan;nan;nan
"7,41E+18";23/08/2024 11.40.42;social_media;tiktok;comment;talk;account;ipbuniversity;"6,89E+18";"6,69E+18";raaaccchhh29;rachemuch;fyp lagi setelah aku keterima di ipb😍;neutral;nan;nan;https://www.tiktok.com/@raaaccchhh29/video/7199615911601523994;nan;"7,20E+18";nan;nan;nan;no-take-out;nan;nan;nan
"7,47E+18";20/02/2025 17.49.00;social_media;tiktok;comment;talk;account;ipbuniversity;"6,89E+18";"7,45E+18";rahm4auly;rahmaau;"fyp ny IPB terus, curiga tahun ini keterima disana🤭";positive ;;;https://www.tiktok.com/@rahm4auly/video/7446708287598267653;;"7,45E+18";;;;no-take-out;;;
"1,83E+16";05/07/2024 11.07.28;social_media;instagram;comment;talk;account;ipbofficial;1818662133;4102333770;andrewtingon;andrewtingon;G54 angkatan 43..salam;neutral;https://instagram.fbdo10-1.fna.fbcdn.net/v/t51.2885-19/333764624_116169731297084_6710683839522196498_n.jpg?stp=dst-jpg_s150x150&_nc_ht=instagram.fbdo10-1.fna.fbcdn.net&_nc_cat=108&_nc_ohc=BsvCWXNriVYQ7kNvgEwEGsi&gid=294f1d8b4c944f97aae929c1704c65cf&edm=AI-cjbYBAAAA&ccb=7-5&oh=00_AYDTtyE0UQTAPsBDIlgfmN8n3WjWucGBjUX_ZmLk12TJ5Q&oe=66B263FD&_nc_sid=0985b0;nan;https://instagram.com/p/C8_uJ-6Sx_L/18269570539173595;nan;"3,40E+18";nan;nan;nan;no-take-out;"3,40E+18";"#SejarahIPB Pada tahun 2000, gedung-gedung perkuliahan dan penunjang kegiatan akademik di Kampus IPB Darmaga terlihat dari udara. Mulai dari Gedung Fakultas Pertanian, Fakultas Kedokteran Hewan, Fakultas Perikanan dan Ilmu Kelautan, Fakultas  Peternakan, Fakultas Kehutanan, dan Fakultas Teknologi Pertanian. Gedung Pusat Administrasi terletak satu sumbu dengan Graha Widya Wisuda (GWW) dan Plaza Akademik, Gedung Pascasarjana terletak berdekatan dengan Gedung Lembaga Sumberdaya Informasi (LSI) serta fasilitas penunjang lainnya seperti Gymnasium, Lapangan Olahraga, Masjid Al Hurriyyah, dan GOR Lama.  Penasaran dengan transformasi lainnya yang ada di IPB? Yuk kunjungi museum dan galeri IPB Future!  #IPBUniversity #IPBNesian #KampusTerbaik #kampusmerdeka";https://instagram.com/p/C8_uJ-6Sx_L
"1,81E+16";05/07/2024 12.39.52;social_media;instagram;comment;talk;account;ipbofficial;1818662133;188466930;syabac;syabac;G6 43 hadir!!;neutral;https://instagram.fbdo10-1.fna.fbcdn.net/v/t51.2885-19/274879837_4651275828310320_3502937492581525370_n.jpg?stp=dst-jpg_s150x150&_nc_ht=instagram.fbdo10-1.fna.fbcdn.net&_nc_cat=100&_nc_ohc=_Z4NEFiFbXAQ7kNvgHBDAXR&gid=631fb82d243842339198476a2f0294f2&edm=AI-cjbYBAAAA&ccb=7-5&oh=00_AYC5oetySfw8W7-KnQn10_5_zpQAAagetA-xXeFcmahiQw&oe=66B26A01&_nc_sid=0985b0;nan;https://instagram.com/p/C8_uJ-6Sx_L/18082714270483897;nan;"3,40E+18";nan;nan;nan;no-take-out;"3,40E+18";"#SejarahIPB Pada tahun 2000, gedung-gedung perkuliahan dan penunjang kegiatan akademik di Kampus IPB Darmaga terlihat dari udara. Mulai dari Gedung Fakultas Pertanian, Fakultas Kedokteran Hewan, Fakultas Perikanan dan Ilmu Kelautan, Fakultas  Peternakan, Fakultas Kehutanan, dan Fakultas Teknologi Pertanian. Gedung Pusat Administrasi terletak satu sumbu dengan Graha Widya Wisuda (GWW) dan Plaza Akademik, Gedung Pascasarjana terletak berdekatan dengan Gedung Lembaga Sumberdaya Informasi (LSI) serta fasilitas penunjang lainnya seperti Gymnasium, Lapangan Olahraga, Masjid Al Hurriyyah, dan GOR Lama.  Penasaran dengan transformasi lainnya yang ada di IPB? Yuk kunjungi museum dan galeri IPB Future!  #IPBUniversity #IPBNesian #KampusTerbaik #kampusmerdeka";https://instagram.com/p/C8_uJ-6Sx_L
"7,45E+18";20/12/2024 09.46.16;social_media;tiktok;comment;talk;account;ipbuniversity;"6,89E+18";"7,18E+18";farrelhaidarbariq;farrel;ga ad TIK;neutral;nan;nan;https://www.tiktok.com/@farrelhaidarbariq/video/7449321596881243397;nan;"7,45E+18";nan;nan;nan;no-take-out;"7,45E+18";POV: IPB is your dream university 💫 Siapa nih yang udah gak sabar untuk kuliah di #KampusTerbaik? Yuk share harapan kalian di kolom komentar! #IPBUniversity #IPBNesian #KampusTerbaik #fyp ;https://www.tiktok.com/@ipbuniversity/video/7449321596881243397
"7,45E+18";19/12/2024 09.12.58;social_media;tiktok;comment;talk;account;ipbuniversity;"6,89E+18";"6,91E+18";stranger_people18;░▒▓▆▅▃▂▁𝐑𝐡𝐲𝐭𝐡𝐦▁▂▃▅▆▓▒░;ga ada d3 farmasi ih😭;neutral;nan;nan;https://www.tiktok.com/@stranger_people18/video/7449321596881243397;nan;"7,45E+18";nan;nan;nan;no-take-out;"7,45E+18";POV: IPB is your dream university 💫 Siapa nih yang udah gak sabar untuk kuliah di #KampusTerbaik? Yuk share harapan kalian di kolom komentar! #IPBUniversity #IPBNesian #KampusTerbaik #fyp ;https://www.tiktok.com/@ipbuniversity/video/7449321596881243397
"1,81E+16";30/04/2025 19.46.21;social_media;instagram;comment;talk;account;ipbofficial;1818662133;65111461000;zulfahmiaqib;zulfahmiaqib;"Ga cocok namanya institut pertanian, tapi jurusan gak nyambung";negative;https://instagram.fupg2-2.fna.fbcdn.net/v/t51.2885-19/464760996_1254146839119862_3605321457742435801_n.png?stp=dst-jpg_e0_s150x150_tt6&cb=8577c754-c2464923&_nc_ht=instagram.fupg2-2.fna.fbcdn.net&_nc_cat=1&_nc_oc=Q6cZ2QFS5i0BQySDyyQziKOTecddDRsD1NHISkLp4lr6Y29ZfKD8c9Hy8ycjXol63kCkCjs&_nc_ohc=IJURGjl6iN0Q7kNvwEiL0Wf&_nc_gid=uKaBV5fEHAB0YqUqZbfwGg&edm=AA0lj5EBAAAA&ccb=7-5&ig_cache_key=YW5vbnltb3VzX3Byb2ZpbGVfcGlj.3-ccb7-5-cb8577c754-c2464923&oh=00_AfLjTHyLVJttDpichsnnXmBrpsONJZYRu1zAvW3w6SlOMA&oe=681F6B28&_nc_sid=0a490e;;https://instagram.com/p/DJBtTbyxsnN/18070094614904646;;"3,62E+18";;;;no-take-out;"3,62E+18";"Halo Para Pejuang IPB University!  Buat kamu yang sering tanya, di IPB tuh ada program studi teknik gak sih? Jawabannya ada loh! IPB University kembali membuka sekolah baru, yaitu Sekolah Teknik! Ini dia beberapa program studi yang menjadi bagian dari Sekolah Teknik.  Persiapkan diri kamu sebaik-baiknya yaa untuk menjadi bagian dari keluarga #KampusTerbaik!  #IPBUniversity #IPBNesian #KampusTerbaik #KampusMerdeka #ayomasukipb";https://instagram.com/p/DJBtTbyxsnN
"1,81E+18";10/07/2024 19.20.49;social_media;twitter;status;talk;keyword;IPB;IPB;"1,69E+18";gateknikgahidup;𝐧𝐚𝐳𝐳²⁴;ga ipb ga Undip smsm error cok;negative;https://pbs.twimg.com/profile_images/1810793594288230402/nem5WkO6_x96.jpg;nan;https://twitter.com/gateknikgahidup/status/1811012701923201537;FT UGM 24;nan;nan;nan;nan;no-take-out;nan;nan;nan
"7,46E+18";03/01/2025 17.19.59;social_media;tiktok;comment;talk;account;ipbuniversity;"6,89E+18";"6,55E+18";laudrehera;Hera Laudre;Ga sabar buat ngerjain skripsi di sinii;positive ;;;https://www.tiktok.com/@laudrehera/video/7455630923866885381;;"7,46E+18";;;;no-take-out;"7,46E+18";"#SpotIPB Tahun baru, spot baru, semangat baru ✨ Ini dia Co-Creation Lounge, spot baru yang cantik dan super nyaman di Perpustakaan IPB University. Co-Creation Lounge hadir sebagai ruang bagi #IPBNesian untuk berkreasi, berbagi ide, dan bereksplorasi!  Kira-kira akan jadi spot favorit #IPBNesian gak nih? Komen di kolom komentar yaaa #IPBUniversity #IPBNesian #KampusTerbaik #KampusMerdeka #SpotIPB";https://www.tiktok.com/@ipbuniversity/video/7455630923866885381
"1,80E+16";26/02/2025 21.34.26;social_media;instagram;comment;talk;account;ipbofficial;1818662133;51860383404;deddwii;deddwii;Ga SE tertarik itu sama IPB tapi kalo UPI plssssssss 😭😭😭😭;negative;https://instagram.fbdo9-1.fna.fbcdn.net/v/t51.2885-19/463824273_1013299050808723_8521302488330959474_n.jpg?stp=dst-jpg_s150x150_tt6&_nc_ht=instagram.fbdo9-1.fna.fbcdn.net&_nc_cat=107&_nc_oc=Q6cZ2AFbraphzlo_P3FsiUPDWNOI4_718eg22q8GgsTiv04-r9fCczXqZLLGkc4I7qw8VZA&_nc_ohc=l80GZg1t240Q7kNvgF9-VnO&_nc_gid=e15ae422a1104a31a5b948ff564e7825&edm=AI-cjbYBAAAA&ccb=7-5&oh=00_AYCiOGx1eomGTXTUgOjhJ-LtC4OJHcXApDK6qFBk8M-DQA&oe=67CC6321&_nc_sid=0985b0;;https://www.instagram.com/p/DFueh7FxNZo/18020276321472324;;"3,56E+18";;;;no-take-out;"3,56E+18";"POV: A bird’s-eye view of IPB University ☀️  From the skies, the dream looks even better than ever.   #IPBUniversity #IPBNesian #KampusTerbaik #KampusMerdeka";https://www.instagram.com/p/DFueh7FxNZo/
"7,46E+18";27/01/2025 10.30.42;social_media;tiktok;comment;talk;account;ipbuniversity;"6,89E+18";"6,85E+18";symutyy;00je;"ga suka hujan, tapi mau hujan hujan kalo di ipb";positive ;;;https://www.tiktok.com/@symutyy/video/7446708287598267653;;"7,45E+18";;;;no-take-out;;;
"1,82E+18";07/08/2024 14.40.49;social_media;twitter;status;talk;keyword;IPB;IPB;"1,33E+18";AqilFi5;Aqil;Gacor betul IPB guest stars nya;positive;https://pbs.twimg.com/profile_images/1815185204631478272/gsLIHFuB_normal.jpg;nan;https://twitter.com/AqilFi5/status/1821089098616160702;"Bashing, smashing, crushing";nan;nan;nan;nan;no-take-out;nan;nan;nan
"1,82E+18";10/08/2024 15.11.09;social_media;twitter;status;talk;keyword;IPB;IPB;"1,44E+18";matchcfee;wawiwaw;gacor ipb🤗🤗🤗 https://t.co/UDHWc4io5a;positive;https://pbs.twimg.com/profile_images/1805955760834449408/maX6oz1G_normal.jpg;nan;https://twitter.com/matchcfee/status/1822183895032307996;nan;nan;nan;nan;nan;no-take-out;nan;nan;nan
UgxjQt2Xzut7OivMdEd4AaABAg;09/08/2024 22.20.21;social_media;youtube;comment;talk;account;IPB TV;UC5tlNLMFpmrY2zUvQSQS-lw;UCbUgZGhI77028UBE6zBkKig;@rizkymaulana2891;@rizkymaulana2891;GACORR NARAPATI BIMANTARAAAAAA;positive;nan;nan;https://www.youtube.com/watch?v=h2ElIw8WhDw;nan;h2ElIw8WhDw;UC5tlNLMFpmrY2zUvQSQS-lw;nan;nan;no-take-out;h2ElIw8WhDw;"Jum’at, 9 Agustus 2024, 4.050 mahasiswa IPB University Angkatan 61 (Narapati Bimantara) memecahkan rekor dunia dengan membuat 76 formasi 3D. Pemecahan rekor dunia bertajuk “The Dynamic Human 3D Interactive Motion Kaleidoscope Formation” ini berlangsung dalam rangkaian kegiatan Masa Pengenalan Kampus Mahasiswa Baru (MPKMB) Tahun 2024. Mahasiswa membuat formasi 3D interaktif dengan menggunakan media berupa notebook yang menceritakan perjalanan IPB University melalui logo, teks, dan kaleidoskop. Rekor ini dicatat oleh Record Holders Republic (RHR). Rektor IPB University, Prof. Dr. Arif Satria menyampaikan apresiasinya kepada seluruh mahasiswa yang berpartisipasi atas pemecahan rekor ini, baik sebagai peserta maupun panitia MPKMB.";https://www.youtube.com/watch?v=h2ElIw8WhDw
"7,45E+18";18/12/2024 13.40.13;social_media;tiktok;comment;talk;account;ipbuniversity;"6,89E+18";"7,28E+18";iamgastlars;bgass;gagal masuk 750 peserta 😥;neutral;nan;nan;https://www.tiktok.com/@iamgastlars/video/7449321596881243397;nan;"7,45E+18";nan;nan;nan;no-take-out;"7,45E+18";POV: IPB is your dream university 💫 Siapa nih yang udah gak sabar untuk kuliah di #KampusTerbaik? Yuk share harapan kalian di kolom komentar! #IPBUniversity #IPBNesian #KampusTerbaik #fyp ;https://www.tiktok.com/@ipbuniversity/video/7449321596881243397
"1,81E+18";01/07/2024 21.36.42;social_media;twitter;status;talk;keyword;IPB;IPB;"1,69E+18";anotherzdies;diiissss;"gais temen2 ipb 60, cara convert sks 7 habits gimana ya😢😢😢😢";neutral;https://pbs.twimg.com/profile_images/1806313207990292480/Rj7TjA8q_normal.jpg;nan;https://twitter.com/anotherzdies/status/1807785405833777352;60 | adis tp era kuliah aja deh;nan;nan;nan;nan;no-take-out;nan;nan;nan
"7,48E+18";20/03/2025 00.45.28;social_media;tiktok;comment;talk;account;ipbuniversity;"6,89E+18";"6,89E+18";heojisungiee;jijiep;gaiss smart agriculture itu nanti kelasnya full pake bahasa inggris atau ngga ya?;neutral;;;https://www.tiktok.com/@heojisungiee/video/7483076891075726598;;"7,48E+18";;;;no-take-out;"7,48E+18";"POV: my dream university has come true ✨ Halo Para Pejuang #KampusTerbaik! Gimana nih hasil pengumuman SNBP hari ini? Buat kamu yang sudah berhasil lolos, selamat yaa! Dan buat kamu yang belum berhasil, jangan berkecil hati, karena masih banyak jalur yang bisa kamu coba untuk menjadi bagian dari IPB University! #IPBUniversity #IPBNesian #SNBP2025 #fyp ";https://www.tiktok.com/@ipbuniversity/video/7483076891075726598
"1,81E+18";09/07/2024 16.04.10;social_media;twitter;status;talk;keyword;IPB;IPB;"9,88E+17";glorievs;Ara. 👒;GAJADI KETEMU DI IPB💔💔💔💔💔💔;neutral;https://pbs.twimg.com/profile_images/1794307775406989312/oEK45se4_normal.jpg;nan;https://twitter.com/glorievs/status/1810600825053483214;nan;"1,81E+18";"9,88E+17";nan;nan;no-take-out;nan;nan;nan
"7,49E+18";17/04/2025 18.59.39;social_media;tiktok;comment;talk;account;ipbuniversity;"6,89E+18";"6,80E+18";mynameisade2_;adeemd | SISILAINMAWANG;Gak sabar kuliah bulan 8🤩 pasca ARL ipb tunggu aku!!!!;positive ;;;https://www.tiktok.com/@mynameisade2_/video/7486420218898599174;;"7,49E+18";;;;no-take-out;"7,49E+18";POV: manifesting berhasil dapat almet impian dari IPB tahun ini ✨ #IPBUniversity #IPBNesian #ayomasukipb #fyp ;https://www.tiktok.com/@ipbuniversity/video/7486420218898599174
"7,46E+18";09/01/2025 17.00.09;social_media;tiktok;comment;talk;account;ipbuniversity;"6,89E+18";"7,33E+18";gisya.wertz;Gisya wertz;gak tau kenapa langsung jatuh hati sama univ ini;positive ;;;https://www.tiktok.com/@gisya.wertz/video/7457838991556267270;;"7,46E+18";;;;no-take-out;"7,46E+18";"Ini dia cuplikan suasana dan lingkungan dari #KampusTerbaik dalam 12 detik. Super cantik dan nyaman, bukan? 🥰 Makin gak sabar untuk berkuliah di IPB University? Yuk, share harapan kamu di kolom komentar! #IPBUniversity #IPBNesian #vibes  #fyp ";https://www.tiktok.com/@ipbuniversity/video/7457838991556267270
"1,82E+18";31/07/2024 08.08.29;social_media;twitter;status;talk;keyword;IPB;IPB;"1,47E+18";pearyush;wav;galau berat liat org" ambil almet ipb mau juga 😔;neutral;https://pbs.twimg.com/profile_images/1813761551083700224/NRfOyDTO_normal.jpg;nan;https://twitter.com/pearyush/status/1818453648147390836;lagi cek suhu neraka;nan;nan;nan;nan;no-take-out;nan;nan;nan
"1,85E+18";26/10/2024 23.22.45;social_media;twitter;status;talk;keyword;IPB;IPB;"1,53E+18";woonaagii;🕊️dellie;galau bgt mau ipb😔;neutral;https://pbs.twimg.com/profile_images/1814609534943703040/TyQE4g4c_normal.jpg;nan;https://twitter.com/woonaagii/status/1850211475866218870;nan;nan;nan;nan;nan;no-take-out;nan;nan;nan
"1,81E+16";10/08/2024 21.39.02;social_media;instagram;comment;talk;account;ipbofficial;1818662133;10444799455;helenaaudiaa;helenaaudiaa;gamon adek bangg;neutral;https://instagram.fbdo10-1.fna.fbcdn.net/v/t51.2885-19/241800557_290860159042795_9046175888390565991_n.jpg?stp=dst-jpg_s150x150&_nc_ht=instagram.fbdo10-1.fna.fbcdn.net&_nc_cat=107&_nc_ohc=g1_tsVnulKYQ7kNvgHMksYp&edm=AI-cjbYBAAAA&ccb=7-5&oh=00_AYAxAXjj-JFTbYN_biPbDPepyCbi5juLuWUaOwyD5Upi1g&oe=66BD91D3&_nc_sid=0985b0;nan;https://www.instagram.com/p/C-fN1PpyGEf/18063527083610005;nan;"3,43E+18";nan;nan;nan;no-take-out;"3,43E+18";"Halo #IPBNesian  Narapati Bimantara telah berhasil memecahkan World Record: The Dynamic Human 3D Interactive Motion Kaleidoscope Formation dengan total 76 formasi! Keren banget gak sih?  Biar gak penasaran dengan keseruannya, yuk kita intip keseruan di balik layar pemecahan World Record, melalui video berikut ini!  #IPBUniversity #IPBNesian #KampusTerbaik #KampusMerdeka";https://www.instagram.com/p/C-fN1PpyGEf/
"7,44E+18";22/11/2024 01.04.04;social_media;tiktok;comment;talk;account;ipbuniversity;"6,89E+18";"6,98E+18";tombopengenid;kimpoll;gamon beut dah;neutral;nan;nan;https://www.tiktok.com/@tombopengenid/video/7439648468030737719;nan;"7,44E+18";nan;nan;nan;no-take-out;"7,44E+18";"IPB joined the trend ✨ IPB secantik ini, yakin gak mau jadi mahasiswanya? Yuk komen, siapa yang udah gak sabar kuliah di #KampusTerbaik!  #IPBUniversity #IPBNesian #trending  #fyp";https://www.tiktok.com/@ipbuniversity/video/7439648468030737719
"1,83E+16";10/08/2024 18.43.01;social_media;instagram;comment;talk;account;ipbofficial;1818662133;50831518680;stckwithu_;stckwithu_;gamon gamon;neutral;https://instagram.fbdo10-1.fna.fbcdn.net/v/t51.2885-19/343238514_723926672847613_7559678906985806472_n.jpg?stp=dst-jpg_s150x150&_nc_ht=instagram.fbdo10-1.fna.fbcdn.net&_nc_cat=101&_nc_ohc=HnO6pEGsVdcQ7kNvgGuITzU&edm=AI-cjbYBAAAA&ccb=7-5&oh=00_AYA_IhnHUzou7TZkFDvGJNrHIS5XknOjSbmdsVB-cjVTSA&oe=66BDB143&_nc_sid=0985b0;nan;https://www.instagram.com/p/C-fN1PpyGEf/18265839877244452;nan;"3,43E+18";nan;nan;nan;no-take-out;"3,43E+18";"Halo #IPBNesian  Narapati Bimantara telah berhasil memecahkan World Record: The Dynamic Human 3D Interactive Motion Kaleidoscope Formation dengan total 76 formasi! Keren banget gak sih?  Biar gak penasaran dengan keseruannya, yuk kita intip keseruan di balik layar pemecahan World Record, melalui video berikut ini!  #IPBUniversity #IPBNesian #KampusTerbaik #KampusMerdeka";https://www.instagram.com/p/C-fN1PpyGEf/
"7,45E+18";11/12/2024 14.46.50;social_media;tiktok;comment;talk;account;ipbuniversity;"6,89E+18";"6,93E+18";dra.dwiraa_;Wiiiiiiiii;"gamon i🥺jurusannya dapet, univ nya engga🥺";neutral;nan;nan;https://www.tiktok.com/@dra.dwiraa_/video/7446708287598267653;nan;"7,45E+18";nan;nan;nan;no-take-out;"7,45E+18";"Rintikan hujan yang turun memberikan kamu kesempatan untuk berhenti sejenak, menikmati sejuknya suasana hari ini.  Untuk #IPBNesian, yuk dijaga selalu kesehatan kamu selama musim hujan ini! #IPBUniversity #IPBNesian #hujan #fyp ";https://www.tiktok.com/@ipbuniversity/video/7446708287598267653
"7,41E+18";20/08/2024 19.14.36;social_media;tiktok;comment;talk;account;ipbuniversity;"6,89E+18";"6,80E+18";ttchacha13;r;gamon mpkmb nie😔;neutral;nan;nan;https://www.tiktok.com/@ttchacha13/video/7403674919906610437;nan;"7,40E+18";nan;nan;nan;no-take-out;"7,40E+18";"Halo #IPBNesian MPKMB 61 sudah berakhir, tapi euforianya masih sangat terasa. Biar gak lupa dengan momen berkesan ini, mimin rangkumin keseruan Narapati Bimantara selama pelaksanaan MPKMB 61! #IPBUniversity #IPBNesian #KampusTerbaik #KampusMerdeka #fyp  @mpkmbipb ";https://www.tiktok.com/@ipbuniversity/video/7403674919906610437
"7,45E+18";10/12/2024 16.52.33;social_media;tiktok;comment;talk;account;ipbuniversity;"6,89E+18";"6,61E+18";iimiirr;imirr;gamon sm ipb😞;neutral;nan;nan;https://www.tiktok.com/@iimiirr/video/7446708287598267653;nan;"7,45E+18";nan;nan;nan;no-take-out;"7,45E+18";"Rintikan hujan yang turun memberikan kamu kesempatan untuk berhenti sejenak, menikmati sejuknya suasana hari ini.  Untuk #IPBNesian, yuk dijaga selalu kesehatan kamu selama musim hujan ini! #IPBUniversity #IPBNesian #hujan #fyp ";https://www.tiktok.com/@ipbuniversity/video/7446708287598267653
"1,81E+18";21/07/2024 14.01.32;social_media;twitter;status;talk;keyword;IPB;IPB;"1,26E+18";jenodeepvoice;atha anomali pembaik;gamonin ipb😔😔😔;neutral;https://pbs.twimg.com/profile_images/1813079760626720770/5eTHOnMq_normal.jpg;nan;https://twitter.com/jenodeepvoice/status/1814918615801417755;UNJ²⁴ || reveluv!;nan;nan;nan;nan;no-take-out;nan;nan;nan
"1,82E+18";02/08/2024 01.14.44;social_media;twitter;status;talk;keyword;IPB;IPB;"7,94E+17";KedaiPenaCom;KedaiPenaCom;"Gandeng IPB, Politisi NasDem Galang Perlawanan Pada Judol dan Pinjol Ilegal via @kedaipenacom https://t.co/4evA3DhFDP";neutral;https://pbs.twimg.com/profile_images/1763240242709245952/VZGHXQHO_normal.jpg;nan;https://twitter.com/KedaiPenaCom/status/1819074300504408194;Kedai Pena - Kedai Berita Nusantara;nan;nan;nan;nan;no-take-out;nan;nan;nan
"1,93E+18";02/06/2025 13.54.53;social_media;twitter;status;talk;account;ipbofficial;114363810;"1,54E+18";urkawaiifu0_0;still fighting yeayyฅ⁠^⁠•⁠ﻌ⁠•⁠^⁠ฅ 🇵🇸;Gapapa insyaaAllah duit boncos daftar mandiri untuk dapetin kamu @ipbofficial  i love u;positive ;https://pbs.twimg.com/profile_images/1602981016724873216/clhuAHL7_normal.jpg;;https://twitter.com/urkawaiifu0_0/status/1929431510408384996;location unknown;;;;;no-take-out;;;
"1,79E+16";17/03/2025 09.18.51;social_media;instagram;comment;talk;account;ipbofficial;1818662133;28599371722;dafaa.maulana_;dafaa.maulana_;gapapa S1 ditolak ipb🥺semoga S2 masuk ipb;neutral;https://scontent-cgk1-2.cdninstagram.com/v/t51.2885-19/470918940_1091719219359524_3605932029708727428_n.jpg?stp=dst-jpg_s150x150_tt6&_nc_ht=scontent-cgk1-2.cdninstagram.com&_nc_cat=108&_nc_oc=Q6cZ2AFS9WtCI19ItI3YRcimmSHQjWBbP3pFQyIF9szSf0OQZn98ohIBDCbGlYvmOpFreRs&_nc_ohc=jQt8QoP-8hsQ7kNvgEOM1tW&_nc_gid=B-uEj6wDzowBah86ZCbawg&edm=AI-cjbYBAAAA&ccb=7-5&oh=00_AYG3Yz4r8RdQHZFvpfAplclYvmiuVy2qkL6skt0Xm4VkbQ&oe=67DE8196&_nc_sid=0985b0;;https://instagram.com/p/DHSHouhSqsJ/17939320268860828;;"3,59E+18";;;;no-take-out;"3,59E+18";"#PrestasiIPB  Pencapaian hari ini menjadi buah dari dedikasi, kerja keras, keringat dan usaha yang tiada henti-hentinya diupayakan.  IPB University berhasil meraih prestasi pada QS World University Rankings by Subject 2025: Agriculture & Forestry, dengan peringkat: - Peringkat 49 Dunia - Peringkat 10 Asia - Peringkat 1 ASEAN - Peringkat 1 Indonesia  Prestasi ini berhasil didapatkan berdasarkan beberapa penilaian, yaitu Research & Discovery (h-Index, sitasi per paper, academic reputation), Global Engagement (international research network), dan Employability (daya saing alumni).  Kami ucapkan terima kasih kepada seluruh pihak yang telah berkontribusi.  Jayalah kampusku, IPB Digdaya!  #IPBUniversity #IPBNesian #KampusTerbaik #KampusMerdeka";https://instagram.com/p/DHSHouhSqsJ
"1,82E+18";23/07/2024 22.09.31;social_media;twitter;status;talk;keyword;IPB;IPB;"1,40E+18";hellowajaa;iraa⁶¹;gapapa stress tapi kan IPB😌;positive;https://pbs.twimg.com/profile_images/1813793398685573120/tWmbJOJ2_normal.jpg;nan;https://twitter.com/hellowajaa/status/1815766199671914975;Status update: Currently happy.;nan;nan;nan;nan;no-take-out;nan;nan;nan
