original_id_x;date_created;resource_type;specific_resource_type;specific_type;post_type;stream_type;object_name;object_content;from_id;from_username;name;content;final_sentiment;from_display_picture;media_link;link;bio;reply_to_original_id;reply_to_user_id;retweet_from_original_id;retweet_from_user_id;identifikasi;original_id_y;content_y;link_y
"7,45E+18";23/12/2024 23.22.28;social_media;tiktok;comment;talk;account;ipbuniversity;"6,89E+18";"6,97E+18";beww0072;krshhhh;bismillah fk jalur falp golden tiket ipb🙏🏻;positive;nan;nan;https://www.tiktok.com/@beww0072/video/7451534899447631110;nan;"7,45E+18";nan;nan;nan;no-take-out;"7,45E+18";"""Kamsahamnida"" versi calon mahasiswa IPB University kira-kira begini nih 😝 Gak sabar jadi bagian dari IPB University? Persiapkan diri kamu dari sekarang. Jangan sampe dadakan, apalagi kelewatan yaa 🫵🏻 #IPBUniversity #IPBNesian #KampusTerbaik #fyp ";https://www.tiktok.com/@ipbuniversity/video/7451534899447631110
"7,44E+18";22/11/2024 13.12.20;social_media;tiktok;comment;talk;account;ipbuniversity;"6,89E+18";"7,01E+18";aditiahermawan18;~;bismillah FKH yallah;positive;nan;nan;https://www.tiktok.com/@aditiahermawan18/video/7439648468030737719;nan;"7,44E+18";nan;nan;nan;no-take-out;"7,44E+18";"IPB joined the trend ✨ IPB secantik ini, yakin gak mau jadi mahasiswanya? Yuk komen, siapa yang udah gak sabar kuliah di #KampusTerbaik!  #IPBUniversity #IPBNesian #trending  #fyp";https://www.tiktok.com/@ipbuniversity/video/7439648468030737719
"1,80E+16";23/12/2024 17.11.09;social_media;instagram;comment;talk;account;ipbofficial;1818662133;54071561128;maesasourls;maesasourls;bismillah fpik;positive;https://instagram.fdac152-1.fna.fbcdn.net/v/t51.2885-19/464760996_1254146839119862_3605321457742435801_n.png?stp=dst-jpg_e0_s150x150_tt6&cb=8577c754-c2464923&_nc_ht=instagram.fdac152-1.fna.fbcdn.net&_nc_cat=1&_nc_ohc=8pHvr5I-mhUQ7kNvgGDIGf7&_nc_gid=71fbadad5dfe451a828602bdeacc540f&edm=AJ1X7eQBAAAA&ccb=7-5&ig_cache_key=YW5vbnltb3VzX3Byb2ZpbGVfcGlj.3-ccb7-5-cb8577c754-c2464923&oh=00_AYCIftPgkZ69KOtsBJ2KeiU0rHSFK8RXs1NTI52FbNWqwA&oe=676FA328&_nc_sid=1cea78;nan;https://instagram.com/p/DD6lTRXzujV/18049776256884032;nan;"3,53E+18";nan;nan;nan;no-take-out;"3,53E+18";"""Kamsahamnida"" versi calon mahasiswa IPB University kira-kira begini nih 😝  Gak sabar jadi bagian dari IPB University? Persiapkan diri kamu dari sekarang. Jangan sampe dadakan, apalagi kelewatan yaa 🫵🏻  #IPBUniversity #IPBNesian #KampusTerbaik #KampusMerdeka";https://instagram.com/p/DD6lTRXzujV
"7,46E+18";09/01/2025 14.58.44;social_media;tiktok;comment;talk;account;ipbuniversity;"6,89E+18";"7,33E+18";aldiy.llzz0;al;bismillah ipb 2025 semoga menjadi rumah ku untuk mencari ilmu satu satu yah universitas;positive ;;;https://www.tiktok.com/@aldiy.llzz0/video/7454498508486298885;;"7,45E+18";;;;no-take-out;;;
"1,81E+16";09/02/2025 21.05.37;social_media;instagram;comment;talk;account;ipbofficial;1818662133;72080843931;leggotostudy;leggotostudy;Bismillah ipb biruuu;neutral;https://scontent-cgk1-2.cdninstagram.com/v/t51.2885-19/474634203_1530150144335780_3957493175380537639_n.jpg?stp=dst-jpg_s150x150_tt6&_nc_ht=scontent-cgk1-2.cdninstagram.com&_nc_cat=108&_nc_oc=Q6cZ2AFp4rkiBPie38BE3kXY0ZIEpzlB6ukHUlPL043GgagssOCdJ_SSiYXNOovdfKLKYsU&_nc_ohc=Fn4IAC_O4FEQ7kNvgGVqcAE&_nc_gid=1e41414d225b4e0986ea698f345f2a1c&edm=AI-cjbYBAAAA&ccb=7-5&oh=00_AYCRptszlGzGk6TJ3ifWGN60G0wO9MsNfSDIoZ_qrSOWcA&oe=67BCE823&_nc_sid=0985b0;;https://instagram.com/p/DFxGjT_yYWo/18059954446795658;;"3,56E+18";;;;no-take-out;"3,56E+18";Live BESTIE Ep 1 - 2025  Kupas Tuntas Jalur Seleksi Nasional Berdasarkan Prestasi (SNBP)   #IPBUniversity #IPBNesian #KampusTerbaik #KampusMerdeka #ayomasukipb;https://instagram.com/p/DFxGjT_yYWo
"1,80E+16";07/02/2025 10.17.49;social_media;instagram;comment;talk;account;ipbofficial;1818662133;40945650032;mdpanjii_;mdpanjii_;BISMILLAH IPB DEPAN MATA;neutral;https://scontent-cgk1-2.cdninstagram.com/v/t51.2885-19/343143016_5996220250459760_8823282947777235946_n.jpg?stp=dst-jpg_s150x150_tt6&_nc_ht=scontent-cgk1-2.cdninstagram.com&_nc_cat=108&_nc_oc=Q6cZ2AFSJQdTVOVE5XdpglTHquJ7J--XN7oa8PuLRUZ4ksHEMlSro3l8F3EBh_yKMiDgrSg&_nc_ohc=0_M_XxhHN0EQ7kNvgEjPSne&_nc_gid=2669b237fe864bbf9f5d038bdb33fe61&edm=AI-cjbYBAAAA&ccb=7-5&oh=00_AYBko7z8NFDnKfav_BQL_9cyEeUpDXjdEvnn40xdjsN7Bw&oe=67BCDA2E&_nc_sid=0985b0;;https://instagram.com/p/DFKe5QUP7Cc/18017184842655723;;"3,55E+18";;;;no-take-out;"3,55E+18";"Halo para pejuang IPB University!  Penasaran ada yang rame-rame,, eh taunya ada info seputar jalur SNBP 2025!   Catat tanggal-tanggal pentingnya, pastikan kamu tidak terlewat yaa 🙌🏻  #IPBUniversity #IPBNesian #KampusTerbaik #KampusMerdeka #snbp2025";https://instagram.com/p/DFKe5QUP7Cc
"1,81E+16";17/02/2025 16.57.22;social_media;instagram;comment;talk;account;ipbofficial;1818662133;47977173187;rznoe_;rznoe_;bismillah ipb tolong terima aku ya 🙏;positive ;https://scontent-cgk1-2.cdninstagram.com/v/t51.2885-19/473006052_1110139497005903_3429767768075042376_n.jpg?stp=dst-jpg_s150x150_tt6&_nc_ht=scontent-cgk1-2.cdninstagram.com&_nc_cat=111&_nc_oc=Q6cZ2AF85FhmxiQTpwkPlY6xX4-knDDjB0Dkrkm3ZWIk75tlhIjFJalPlNn-R4b0Yo5psLc&_nc_ohc=q3iwoD3GTVMQ7kNvgFurL7W&_nc_gid=a0d68d09a7534dec9dbbae5800876005&edm=AI-cjbYBAAAA&ccb=7-5&oh=00_AYD5M93tFxRuQmwZ-hqYPUZYmaeEHr451LBGg9S19Ei-rQ&oe=67BCE885&_nc_sid=0985b0;;https://instagram.com/p/DGK0D7SynBw/18077429722632403;;"3,57E+18";;;;no-take-out;"3,57E+18";Live BESTIE Ep 02-2025  Bedah Program Studi IPB University 1. Fisika 2. Teknologi dan Manajemen Perikanan Tangkap  #IPBUniversity #IPBNesian #KampusTerbaik #KampusMerdeka;https://instagram.com/p/DGK0D7SynBw
"7,42E+18";03/10/2024 19.40.56;social_media;tiktok;comment;talk;account;ipbuniversity;"6,89E+18";"7,13E+18";ardian.cxz2;GRexy;BISMILLAH IPBBBBBBB;positive;nan;nan;https://www.tiktok.com/@ardian.cxz2/video/7418517736944618758;nan;"7,42E+18";nan;nan;nan;no-take-out;"7,42E+18";"proud to be #IPBNesian 🔥 ngacung, siapa nih yang mau jadi bagian dari keluarga #KampusTerbaik? yuk komen di kolom komentar! #IPBUniversity #IPBNesian #KampusTerbaik #fyp";https://www.tiktok.com/@ipbuniversity/video/7418517736944618758
"1,80E+16";24/04/2025 16.17.18;social_media;instagram;comment;talk;account;ipbofficial;1818662133;62299059250;kodeprivatalfaiz;kodeprivatalfaiz;Bismillah LOLOS SNBT 2025💙💙💙;positive;https://scontent-cgk2-2.cdninstagram.com/v/t51.2885-19/475731552_594519410172994_1013793563461134725_n.jpg?stp=dst-jpg_s150x150_tt6&_nc_ht=scontent-cgk2-2.cdninstagram.com&_nc_cat=110&_nc_oc=Q6cZ2QEttJy_fKO9Nx5Gwu0DswHjgipmqCvtpwYBVqDMSVdTdFOUm7V_2Elr0D7sQclA-Bk&_nc_ohc=P4ieZTvUdQwQ7kNvwFh4fEx&_nc_gid=utYaOfRSMA6VCD-DCS-O3g&edm=AI-cjbYBAAAA&ccb=7-5&oh=00_AfENXWFpE8Ssu59mXPNOFD-snAMC2tVpL5U7nNmBlL5PvA&oe=68108328&_nc_sid=0985b0;;https://instagram.com/p/DI0tH1BRTLk/18038386307545842;;"3,62E+18";;;;no-take-out;"3,62E+18";"Halo Para Pejuang SNBT!  Bingung mau kemana sebelum atau setelah ujian? Ini dia beberapa rekomendasi tempat yang bisa kamu datengin sama teman atau keluarga kamu! Save video ini biar gak bingung pas UTBK-SNBT nanti yaa  Komen di kolom komentar, kira-kira tempat mana yang paling mau kamu datengin!  #IPBUniversity #IPBNesian #KampusTerbaik #KampusMerdeka #UTBKIPB";https://instagram.com/p/DI0tH1BRTLk
"1,81E+16";07/07/2024 19.17.47;social_media;instagram;comment;talk;account;ipbofficial;1818662133;63541831049;truuuulyy;truuuulyy;Bismillah lulus ked hewan 🤲;positive;https://instagram.fbdo10-1.fna.fbcdn.net/v/t51.2885-19/441655911_1111630996812702_1648321730548035116_n.jpg?stp=dst-jpg_s150x150&_nc_ht=instagram.fbdo10-1.fna.fbcdn.net&_nc_cat=106&_nc_ohc=wBACt-4LVTQQ7kNvgEWOprV&gid=f514a2021109485f971cfc841968bd55&edm=AI-cjbYBAAAA&ccb=7-5&oh=00_AYDyP5g6Q0oNDp7lloC8GGpN4HZusnweLgkDCNtAKuAm6A&oe=66B25ECF&_nc_sid=0985b0;nan;https://instagram.com/p/C89G-DMRkuh/18135299164337393;nan;"3,40E+18";nan;nan;nan;no-take-out;"3,40E+18";BESTIE Ep 22-2024  Bedah Program Studi (Prodi) Kelas Internasional - Biologi - Kimia - Kedokteran Hewan  #IPBUniversity #IPBNesian #KampusTerbaik #KampusMerdeka;https://instagram.com/p/C89G-DMRkuh
"1,83E+16";25/07/2024 18.42.41;social_media;instagram;comment;talk;account;ipbofficial;1818662133;38341332747;adrrhn_;adrrhn_;Bismillah maba 2025;positive;https://instagram.fcgk27-1.fna.fbcdn.net/v/t51.2885-19/44884218_345707102882519_2446069589734326272_n.jpg?_nc_ht=instagram.fcgk27-1.fna.fbcdn.net&_nc_cat=1&_nc_ohc=CPypOP_IlOEQ7kNvgFnE4Gs&gid=4f12fdf6fabd46d7bf5234ce364efaf0&edm=ALlQn9MBAAAA&ccb=7-5&ig_cache_key=YW5vbnltb3VzX3Byb2ZpbGVfcGlj.2-ccb7-5&oh=00_AYC3SXcjnRIQ4U96y49Ydkaj2PrFQ_TJYnVe9fI1-9BG6A&oe=66B2680F&_nc_sid=e7f676;nan;https://www.instagram.com/p/C9uEnX_yju6/18280257448226699;nan;"3,42E+18";nan;nan;nan;no-take-out;"3,42E+18";"POV: i love this place for so long 💙  Siapa nih yang selalu jatuh cinta melihat Kampus IPB University? Coba mimin mau tau dong, apa sih yang bikin kamu suka banget sama #KampusTerbaik ini? Komen dibawah yaa!  #IPBUniversity #IPBNesian #KampusTerbaik #KampusMerdeka";https://www.instagram.com/p/C9uEnX_yju6/
"7,45E+18";27/12/2024 10.45.24;social_media;tiktok;comment;talk;account;ipbuniversity;"6,89E+18";"7,11E+18";reisyaghani;legenda3400;bismillah mana ipb 2025;neutral;nan;nan;https://www.tiktok.com/@reisyaghani/video/7452275863242018053;nan;"7,45E+18";nan;nan;nan;no-take-out;"7,45E+18";"Ternyata kakak-kakak yang sibuk cari informasi seputar IPB itu kita sekarang 💫 Halo Calon Mahasiswa #KampusTerbaik! Ada banyak jalan menuju Roma, ada banyak jalur untuk menjadi mahasiswa IPB University!  Yuk, pilih jalurnya dan persiapkan diri kamu. Kami tunggu kamu untuk jadi bagian dari keluarga #KampusTerbaik 🙌🏻 #IPBUniversity #IPBNesian #KampusTerbaik #KampusMerdeka #ayomasukipb ";https://www.tiktok.com/@ipbuniversity/video/7452275863242018053
"7,45E+18";10/12/2024 23.23.45;social_media;tiktok;comment;talk;account;ipbuniversity;"6,89E+18";"7,12E+18";daffaalthaf486;tong45;bismillah manifesting😁😁;positive;nan;nan;https://www.tiktok.com/@daffaalthaf486/video/7446708287598267653;nan;"7,45E+18";nan;nan;nan;no-take-out;"7,45E+18";"Rintikan hujan yang turun memberikan kamu kesempatan untuk berhenti sejenak, menikmati sejuknya suasana hari ini.  Untuk #IPBNesian, yuk dijaga selalu kesehatan kamu selama musim hujan ini! #IPBUniversity #IPBNesian #hujan #fyp ";https://www.tiktok.com/@ipbuniversity/video/7446708287598267653
"1,81E+16";17/08/2024 14.48.48;social_media;instagram;comment;talk;account;ipbofficial;1818662133;61416875489;nzsjkls;nzsjkls;bismillah masuk ipb😍;positive;https://scontent-cgk2-1.cdninstagram.com/v/t51.2885-19/464760996_1254146839119862_3605321457742435801_n.png?stp=dst-jpg_s150x150_tt6&cb=8577c754-c2464923&_nc_ht=scontent-cgk2-1.cdninstagram.com&_nc_cat=1&_nc_oc=Q6cZ2AF_FAMrW0Z6qwmQNyNRdWQS0wClUYibAciqnmfc_WmafRmGWb4CeVDlOai8VJT_nPk&_nc_ohc=jepgp6A8CCYQ7kNvgFn6QB7&_nc_gid=89d3e80129134a6cb97c725ac3f837cb&edm=AI-cjbYBAAAA&ccb=7-5&ig_cache_key=YW5vbnltb3VzX3Byb2ZpbGVfcGlj.3-ccb7-5-cb8577c754-c2464923&oh=00_AYBsYReOkldseOfnnIxQ0GS8eMq6npohFsXYVsHre-jJpA&oe=67BCC2E8&_nc_sid=0985b0;nan;https://www.instagram.com/p/C-CoYg7SVjr/18100271284436856;nan;"3,42E+18";nan;nan;nan;no-take-out;"3,42E+18";"Siapa yang gak sabar foto pakai jas almamater impian? 🫵🏻  Halo #IPBNesian Yuk intip keseruan Narapati Bimantara saat pengambilan jas almamater IPB University  Siapin foto terbaik kalian, jangan lupa tag mimin yaa!  #IPBUniversity #IPBNesian #KampusTerbaik #KampusMerdeka";https://www.instagram.com/p/C-CoYg7SVjr/
"7,40E+18";13/08/2024 15.14.04;social_media;tiktok;comment;talk;account;ipbuniversity;"6,89E+18";"6,96E+18";abcd.umpppp;CacaMalatani02;Bismillah S2 disini🥹;positive;nan;nan;https://www.tiktok.com/@abcd.umpppp/video/7199615911601523994;nan;"7,20E+18";nan;nan;nan;no-take-out;nan;nan;nan
"1,81E+18";10/07/2024 10.38.30;social_media;twitter;status;talk;keyword;IPB;IPB;"1,68E+18";inthewotah;jaheura²⁵;bismillah sb ipb62;positive;https://pbs.twimg.com/profile_images/1799039143647006720/-SFZUzN1_normal.jpg;nan;https://twitter.com/inthewotah/status/1810881253526360084;"ikhtiar, doa, tawakal";nan;nan;nan;nan;no-take-out;nan;nan;nan
"1,80E+16";13/01/2025 09.54.49;social_media;instagram;comment;talk;account;ipbofficial;1818662133;5509497162;latifa_umichikal;latifa_umichikal;"Bismillah semoga anakku tahun ini bisa kuliah di sini, Aamiin Ya rabbal Alamin";positive ;https://instagram.fbdo9-1.fna.fbcdn.net/v/t51.2885-19/471777993_1139037934891955_2632791182912939934_n.jpg?stp=dst-jpg_s150x150_tt6&_nc_ht=instagram.fbdo9-1.fna.fbcdn.net&_nc_cat=111&_nc_oc=Q6cZ2AFXe3C_rnG63_fTzOIfMKlQSPkS-NnUC7VpF_PmGvNjZKt5DgBjRrf2UqGJxvsrbdk&_nc_ohc=kC3Wl_FIPFYQ7kNvgGeukYk&_nc_gid=d475ce3a5822463f94881683eb0312b0&edm=AI-cjbYBAAAA&ccb=7-5&oh=00_AYBJrs_J5uU8JvAALWzgQk302Ag-oxJ345XkL8W-SGF54A&oe=679E4ADB&_nc_sid=0985b0;;https://instagram.com/p/DEo7sVzxDC7/17982899729639041;;"3,54E+18";;;;no-take-out;"3,54E+18";"Ini dia cuplikan suasana dan lingkungan dari #KampusTerbaik dalam 12 detik. Super cantik dan nyaman, bukan? 🥰  Makin gak sabar untuk berkuliah di IPB University? Yuk, share harapan kamu di kolom komentar!  #IPBUniversity #IPBNesian #KampusTerbaik #KampusMerdeka";https://instagram.com/p/DEo7sVzxDC7
"7,48E+18";26/02/2025 23.03.32;social_media;tiktok;comment;talk;account;ipbuniversity;"6,89E+18";"6,84E+18";otherside_ffa;D;Bismillah semoga keterima di ipb tahun ini melalui jalur snbp tanggal 18 Maret 2025.🤲;positive ;;;https://www.tiktok.com/@otherside_ffa/video/7465630532299246853;;"7,47E+18";;;;no-take-out;"7,47E+18";"Kabar gembira untuk kamu para pejuang #KampusTerbaik! Tahun ini, akan ada penambahan kuota bagi calon mahasiswa, untuk program sarjana dan sarjana terapan. Yuk cek informasi selengkapnya di website admisi.ipb.ac.id Semangat para pejuang IPB University 🙌🏻 #IPBUniversity #IPBNesian #ayomasukipb #fyp ";https://www.tiktok.com/@ipbuniversity/video/7465630532299246853
"1,79E+16";07/02/2025 15.38.15;social_media;instagram;comment;talk;account;ipbofficial;1818662133;5381577071;dianlesmana28;dianlesmana28;Bismillah semoga SNBP 2025 anakku lolos IPB 🤲;positive ;https://scontent-cgk1-1.cdninstagram.com/v/t51.2885-19/472444544_957015349662681_7663119658374527171_n.jpg?stp=dst-jpg_s150x150_tt6&_nc_ht=scontent-cgk1-1.cdninstagram.com&_nc_cat=109&_nc_oc=Q6cZ2AHQCcIab7Zner-mtqD2TjB-svB77R5CiqpW7P2Dh099xuHKs19cTzFq6rJ8gOMjZ5c&_nc_ohc=6DQxr_42hH0Q7kNvgFIFNUa&_nc_gid=8dd4525218ed45eb82da4b26f30c747e&edm=AI-cjbYBAAAA&ccb=7-5&oh=00_AYAUD4M6bPeDfrEg8nbk6K7mI_f8K6D5Qwf9AkGK-kgwXQ&oe=67BCE325&_nc_sid=0985b0;;https://instagram.com/p/DEo7sVzxDC7/17903968359016609;;"3,54E+18";;;;no-take-out;"3,54E+18";"Ini dia cuplikan suasana dan lingkungan dari #KampusTerbaik dalam 12 detik. Super cantik dan nyaman, bukan? 🥰  Makin gak sabar untuk berkuliah di IPB University? Yuk, share harapan kamu di kolom komentar!  #IPBUniversity #IPBNesian #KampusTerbaik #KampusMerdeka";https://instagram.com/p/DEo7sVzxDC7
"7,45E+18";10/12/2024 19.47.47;social_media;tiktok;comment;talk;account;ipbuniversity;"6,89E+18";"6,96E+18";kakiaay;kakiaay;bismillah soon udah di disini;positive;nan;nan;https://www.tiktok.com/@kakiaay/video/7330571582017948934;nan;"7,33E+18";nan;nan;nan;no-take-out;nan;nan;nan
"1,81E+16";29/04/2025 18.51.04;social_media;instagram;comment;talk;account;ipbofficial;1818662133;42515673737;dewi_wlandarii;dewi_wlandarii;bismillah tekpang ipb😍;neutral;https://scontent-cgk2-1.cdninstagram.com/v/t51.2885-19/463899869_901562628578238_5173842055783729534_n.jpg?stp=dst-jpg_s150x150_tt6&_nc_ht=scontent-cgk2-1.cdninstagram.com&_nc_cat=106&_nc_oc=Q6cZ2QEU1xKOw17HjN7zapn1ek27-SSCeTRIUCqCsSwWD-FKqXm4EjZBEyxnwQ5Z2j3xOh0&_nc_ohc=DhTEosg4EGEQ7kNvwHl8Hxa&_nc_gid=9Enwc4SRE_e9VtkyVN-1GQ&edm=AI-cjbYBAAAA&ccb=7-5&oh=00_AfJLYF8JY9YqAsx8puC7lmCsdbtaYeemPn_ZfOn1EJV3zw&oe=681F6667&_nc_sid=0985b0;;https://instagram.com/p/DJBtTbyxsnN/18085068364566225;;"3,62E+18";;;;no-take-out;"3,62E+18";"Halo Para Pejuang IPB University!  Buat kamu yang sering tanya, di IPB tuh ada program studi teknik gak sih? Jawabannya ada loh! IPB University kembali membuka sekolah baru, yaitu Sekolah Teknik! Ini dia beberapa program studi yang menjadi bagian dari Sekolah Teknik.  Persiapkan diri kamu sebaik-baiknya yaa untuk menjadi bagian dari keluarga #KampusTerbaik!  #IPBUniversity #IPBNesian #KampusTerbaik #KampusMerdeka #ayomasukipb";https://instagram.com/p/DJBtTbyxsnN
"7,46E+18";06/01/2025 23.42.43;social_media;tiktok;comment;talk;account;ipbuniversity;"6,89E+18";"7,08E+18";wiuuwiu1234;wiuu wiuu;"bismillah ya IPB, terima aku tahun ini jalur SNBP🤩";positive ;;;https://www.tiktok.com/@wiuuwiu1234/video/7454498508486298885;;"7,45E+18";;;;no-take-out;;;
"1,82E+18";12/08/2024 15.44.00;social_media;twitter;status;talk;keyword;IPB;IPB;398819165;sitihairul;catatansiemak.com;"Bismillah, semoga lancar dan dimudahkan. Lulus tepat waktu dan berkah-bermanfaat.  as PhD student at Family and Children Studies dept,  IPB University https://t.co/IxH7vcPt02";positive;https://pbs.twimg.com/profile_images/1548954463066419202/AKy-WcvY_normal.jpg;nan;https://twitter.com/sitihairul/status/1822916937019748518;#momblogger #homeschooler #contentwriter #scriptwriter *membaca dan menulis untuk bersenang-senang* 📩sitihairuldayah@gmail.com IG: @siti_hairul;nan;nan;nan;nan;no-take-out;nan;nan;nan
"7,47E+18";01/02/2025 18.48.22;social_media;tiktok;comment;talk;account;ipbuniversity;"6,89E+18";"6,97E+18";ekaiis0206;eka/iis;"Bismillah,IPB University kampus impian semoga anak bungsuku bisa lolos snbp 2025 aamiin🤲🏻😇🫰";positive ;;;https://www.tiktok.com/@ekaiis0206/video/7454498508486298885;;"7,45E+18";;;;no-take-out;;;
"7,47E+18";11/02/2025 17.37.10;social_media;tiktok;comment;talk;account;ipbuniversity;"6,89E+18";"6,94E+18";elis78934;elis78934;"bismillah,mau tanya pengurangan biaya kuliah itu tidak merata ya Krn anak saya tdk berkurang biaya kuliah nya,temannya berkurang ko bisa spt itu ya🙏";neutral;;;https://www.tiktok.com/@elis78934/video/7468232376800300294;;"7,47E+18";;;;no-take-out;"7,47E+18";"POV: A birds-eye view of IPB University ☀️ From the skies, the dream looks even better than ever.  #IPBUniversity #IPBNesian #ayomasukipb  #droneshot  #fyp ";https://www.tiktok.com/@ipbuniversity/video/7468232376800300294
"7,50E+18";28/04/2025 17.30.10;social_media;tiktok;comment;talk;account;ipbuniversity;"6,89E+18";"6,90E+18";bhimakncna_;BhimaGwenchana_;Bismillahirrahmanirrahim 2026 Keterima di IPB.Aamiinnn🤲🥹;positive ;;;https://www.tiktok.com/@bhimakncna_/video/7498306501375757623;;"7,50E+18";;;;no-take-out;"7,50E+18";"Halo Para Pejuang IPB University! Banyak jalan menuju Roma, banyak jalur untuk menjadi keluarga #KampusTerbaik! Saat ini, pendaftaran Program Kelas Internasional sedang dibuka loh! Penasaran ada program studi apa saja? Yuk simak video berikut ini! Informasi seputar jalur masuk IPB University bisa kamu akses di admisi.ipb.ac.id ✨ #IPBUniversity #IPBNesian #kelasinternasional  #fyp";https://www.tiktok.com/@ipbuniversity/video/7498306501375757623
"7,44E+18";09/11/2024 09.55.17;social_media;tiktok;comment;talk;account;ipbuniversity;"6,89E+18";"6,94E+18";yagitudeh_1234;yagitudehh;Bismillahirrahmanirrahim bisa S2 di IPB🥹🤍;positive;nan;nan;https://www.tiktok.com/@yagitudeh_1234/video/7432234433542999301;nan;"7,43E+18";nan;nan;nan;no-take-out;"7,43E+18";"#WisudaIPB Merayakan berakhirnya perjuangan, sebelum memulai kembali pada lembaran yang baru. Ini dia suasana Wisuda IPB University Tahap V TA 2024/2025!  Cherish many more moments to come~ #IPBUniversity #IPBNesian #Wisuda #fyp";https://www.tiktok.com/@ipbuniversity/video/7432234433542999301
"7,44E+18";21/11/2024 11.48.23;social_media;tiktok;comment;talk;account;ipbuniversity;"6,89E+18";"7,15E+18";nur080202;nur;"bismillahirrahmanirrahim S2 disini, dengan keajaiban aamiin 🤲";positive;nan;nan;https://www.tiktok.com/@nur080202/video/7199615911601523994;nan;"7,20E+18";nan;nan;nan;no-take-out;nan;nan;nan
"7,47E+18";07/02/2025 14.05.51;social_media;tiktok;comment;talk;account;ipbuniversity;"6,89E+18";"7,19E+18";erasapta3;bunz buns;Bismillahirrahmanirrahim universitas impian anak ku 🥰;positive ;;;https://www.tiktok.com/@erasapta3/video/7449321596881243397;;"7,45E+18";;;;no-take-out;;;
"1,83E+18";01/09/2024 07.28.24;social_media;twitter;status;talk;keyword;IPB;IPB;"1,18E+18";SAASH1MI;caca 🍣;BJIRRRR IPB SKRG PUNYA GOLF SIMULATOR CUYYYYY https://t.co/lNpwAG3sVa;positive;https://pbs.twimg.com/profile_images/1816689640302346240/ajOgmfbN_normal.jpg;nan;https://twitter.com/SAASH1MI/status/1830039973262999743;just a regular business major girlie | yapping hour: pas kena macet;nan;nan;nan;nan;no-take-out;nan;nan;nan
"1,82E+18";22/07/2024 17.28.50;social_media;twitter;status;talk;keyword;IPB;IPB;"1,40E+18";thenightwemetji;*;"blom 7 habit, blom dr class ipb, blom dari pdf tugas aksa";neutral;https://pbs.twimg.com/profile_images/1805223845076541440/n6XG3Xv1_normal.jpg;nan;https://twitter.com/thenightwemetji/status/1815333174865719490;haha hihi tiba tiba “ada info loker ga?” #DISH// er;nan;nan;nan;nan;no-take-out;nan;nan;nan
"1,82E+18";10/08/2024 23.35.53;social_media;twitter;status;talk;keyword;IPB;IPB;"1,81E+18";zzalshfa;zalfa;bm lanyard ipb;neutral;https://pbs.twimg.com/profile_images/1814274007019167744/uurFsx4Z_normal.jpg;nan;https://twitter.com/zzalshfa/status/1822310914902646870;sjmp61;nan;nan;nan;nan;no-take-out;nan;nan;nan
"1,83E+18";02/09/2024 19.53.14;social_media;twitter;status;talk;keyword;IPB;IPB;"1,82E+18";zekyyzek;zeki;bocah fomo bikin twibbon dies natalis 61 ipb😭🖐🏻 https://t.co/ptJ5MArlnX;negative;https://pbs.twimg.com/profile_images/1820121972887719936/S7vRGGqS_normal.jpg;nan;https://twitter.com/zekyyzek/status/1830589804884717658;swifties here🫂 knp y gua bikin akun sec dlu baru akun first inikh🫵🏻;nan;nan;nan;nan;no-take-out;nan;nan;nan
"1,83E+18";19/08/2024 17.33.12;social_media;twitter;status;talk;keyword;IPB;IPB;"8,03E+17";bsip_sdlp;BSIP SDLP 🇮🇩;Bogor (16/08/2024) - Balai Besar Pengujian Standar Instrumen Sumberdaya Lahan Pertanian (BSIP SDLP) menerima kunjungan dari Tim PKM VGK IPB yang terdiri dari 5 orang mahasiswa untuk melakukan audiensi dengan judul “Consurfation: Integrated Alternating Raised Bed System- https://t.co/ahPPFzTYwg;neutral;https://pbs.twimg.com/profile_images/1660535254204178435/LOOWTbrN_normal.jpg;nan;https://twitter.com/bsip_sdlp/status/1825481134144426029;Ini adalah akun resmi Balai Besar Pengujian Standar Instrumen Sumberdaya Lahan Pertanian (BSIP SDLP);nan;nan;nan;nan;no-take-out;nan;nan;nan
"1,87E+18";01/01/2025 13.58.36;social_media;twitter;status;talk;account;ipbofficial;114363810;"8,65E+17";triviapsh;ًdibb;"bohong kalo gw ga sedih, jahat banget lu ama gw @ipbofficial";negative;https://pbs.twimg.com/profile_images/1567149377873137664/xdw_cGel_normal.jpg;;https://twitter.com/triviapsh/status/1874349490603516260;akun bercanda;;;;;no-take-out;;;
"1,83E+18";22/08/2024 22.09.04;social_media;twitter;status;talk;keyword;IPB;IPB;"1,46E+18";cowbetina;nur;"Boleh banget nih di kandang A rumbes fapet IPB, bisa koordinasi sama yg piket pagi rumbes besok.";neutral;https://pbs.twimg.com/profile_images/1824809946455891968/iwurYK4Y_normal.jpg;nan;https://twitter.com/cowbetina/status/1826637722116915304;is reading 📚;nan;nan;nan;nan;no-take-out;nan;nan;nan
"7,49E+18";27/03/2025 17.08.06;social_media;tiktok;comment;talk;account;ipbuniversity;"6,89E+18";"6,99E+18";im_is4u;cipakamubisa;boleh ke perpus ipb gasih min?😭🙏;neutral;;;https://www.tiktok.com/@im_is4u/video/7480129548034575671;;"7,48E+18";;;;no-take-out;"7,48E+18";"Tell me something i dont know ⁉️ Buat kamu para pejuang SNBT 2025, ada banyak benefit yang bisa kamu dapatkan ketika memilih IPB University sebagai lokasi UTBK! Kira-kira apa aja yaa? Jangan skip video ini kalo mau tau jawabannya. Cari lokasi UTBK-SNBT yang nyaman? Ya, di IPB University ajaa! #IPBUniversity #IPBNesian #utbk2025  #fyp ";https://www.tiktok.com/@ipbuniversity/video/7480129548034575671
"1,81E+16";22/03/2025 21.10.26;social_media;instagram;comment;talk;account;ipbofficial;1818662133;5922425210;wahiniyuni;wahiniyuni;Boleh lah kak asal diterima JD bagian IPB 😂;positive ;https://scontent-cgk1-1.cdninstagram.com/v/t51.2885-19/466075185_919878686203245_4840341544832977661_n.jpg?stp=dst-jpg_s150x150_tt6&_nc_ht=scontent-cgk1-1.cdninstagram.com&_nc_cat=109&_nc_oc=Q6cZ2QHxdWYYLD4KwHz5WzGCIQ5cvZbu33246VJ2AdhavnKZMH8Uu-ZBfgdB4eC2-XEgMnk&_nc_ohc=7vbNxWieAWQQ7kNvgHbqnj-&_nc_gid=Wuh-ZduBTG9oZXI7Kp187A&edm=AI-cjbYBAAAA&ccb=7-5&oh=00_AYFSdbc0QXZKAqjRQnnQrXb9YMGpCEKKB3t7mcq0nIiuxQ&oe=67E52BE8&_nc_sid=0985b0;;https://instagram.com/p/DHdWWBbxYf7/18138955621390571;;"3,59E+18";;;;no-take-out;"3,59E+18";"Halo Pejuang SNBT!  Kamu pilih lokasi ujian UTBK-SNBT di IPB University? Pas banget nih, ada rekomendasi beberapa kantin favorit #IPBNesian yang bisa kamu cobain sebelum atau setelah ujian UTBK di IPB University. Tonton sampai habis dan save video ini biar kamu gak bingung mau makan dimana!  Gimana nih, jadi makin yakin pilih lokasi ujian UTBK-SNBT di IPB University kan?   #IPBUniversity #IPBNesian #KampusTerbaik #KampusMerdeka #UTBKIPB";https://instagram.com/p/DHdWWBbxYf7
"7,43E+18";29/10/2024 19.18.12;social_media;tiktok;comment;talk;account;ipbuniversity;"6,89E+18";"6,79E+18";evanurrrrrrrrr;sabilaheva;botani bakery saksi aku nge draft skripsi🤣😂;neutral;nan;nan;https://www.tiktok.com/@evanurrrrrrrrr/video/7417765761655213317;nan;"7,42E+18";nan;nan;nan;no-take-out;"7,42E+18";#SpotIPB Ini dia beberapa kantin favorit #IPBNesian yang ada di IPB University. Mana nih kantin jagoan kamu? Komen di kolom komentar yaa! #IPBUniversity #IPBNesian #kantin  #fyp ;https://www.tiktok.com/@ipbuniversity/video/7417765761655213317
